reported,url
"Hovering, shapeshifting object becomes a sold white oval.  I was on a delivery route in Pflugerville, Texas.  It was 11:15 in the morning, 60 degrees with a beautiful blue sky.   I pulled into an apartment complex off of the 35 freeway and saw something white floating/hovering in the sky to the north.   I stopped in the driveway of the complex to focus on the object.   It looked like a white plastic bag tossing in the wind, morphing in shape the way a bag would morph in the wind, but it was staying in the same spot, at about a 45 degree angle up and what looked like maybe one or two miles away.   Unable to figure out what it was, I pulled the rest of the way into the parking lot and got out, hoping it wouldn’t disappear in the 30 seconds it took to do that.   It was still there, still in the same spot, still morphing or flopping about.   I thought, ‘that can’t be a plastic bag, as it’s too far away for it to be as big as i see it’ (a little smaller than a dime held at arms length) - it would have to be an enormous plastic bag if that were the case.   So i thought, ‘okay, is it a paraglider twisting and turning?’  but it never showed itself to be that.  I can usually get that figured out pretty quickly as they move about.  So no, it wasn’t that.   After a couple of minutes of watching it and wondering what it was, it stopped morphing and became a stable, hovering, oval-shaped white object.  I couldn’t tell if it was a light, or if it was just a bright white object reflecting off the sun against the blue sky.   I got my phone to try to take a video, but after a few seconds I knew I wasn't going to get it (plus I don’t know how to work the zoom on my phone, if there is one), so i gave that up and just observed it.   A couple of apartment complex workers came up to see what i was looking at.  I point it out to them and one of them said, ""It’s a plane.""  I responded, ""No, that’s not a plane"", and they leave.   At this point I noticed that it seemed to be getting further away, like it was receding away from me - it wasn’t moving left or right, and it stayed at the same 45 degree angle up in the sky, but it was getting smaller, like it was moving directly away from me, all the while still a solid white oval.   I thought it must be 10 or so miles away now, so I called my brother in Round Rock, Texas, ten miles north of where I was at, and told him what I was seeing and asked him to go out to see if he also could see it.  He went out but couldn't find it.   I continued to watch it for a few more minutes and watched as it got smaller and smaller, still apparently moving directly away from me, until it looked just like a bright star in the clear daytime sky, far enough away now that I couldn’t see the oval shape to it anymore.   I decided to make the delivery that I was scheduled to make at the apartment complex.  It took about five minutes to do so, and when I finished, I tried to locate the object again, but couldn’t find it.   There was no sound associated with the object that I could hear.  The length of time of my observation was about 7 minutes.  In that amount of time, I think I should have been able to identify what I was looking at, eventually seeing wings, or movement, or a change in course that would have allowed me to see it from a different perspective and know what it was.  That never happened.",
Seen light outside southwest. It started moving torward  the north after a short time.  The subject was southwest of my home. I was sitting on couch looked over torward the window. And seen this light look sort of like a rectangle with some jagged edges on top.it was there it seemed for awhile then started moving slowly torward the north.,
"please see above sorry  I would guess at 5,000 feet Going very fast.  300+ mph Absolutly no sound Shaped like a boomerang,  pretty large.  100-150 feet wide.  50 feet diameter in the middle.  not sure how thick it was first one was moving due South then turned and went off to the South East.  Then about a minute later a second one came straight overhead and traveling from the North due South without any change.  It was very calm not even a breeze, not a cloud in the sky.  The objects had the appearance of transparancy like a cloud, white in color.",
"Several objects seen moving with orbs, everynight in same area for 10 months.  Possible abductions.  SIGHTINGS HAVE BEEN OCCURRING IN THIS AREA SINCE DECEMBER, 2020. OBJECTS THAT SEEM TO BE ROUND AT A DISTANCE WITH ORBS CIRCLING THEM. THESE OBJECTS SEEM TO BE LIT-UP LIKE A CAROUSEL, BUT MOVES AROUND IN SKY. HAVE SEEN A CIGAR SHAPED OBJECT AS WELL, BROWN IN COLOR.  ALSO, ONE THAT LOOKS LIKE A SPIDER WHEN IT EXPANDS WITH LIGHTS ON WHAT LOOKS LIKE EXPANDED TENTACLES. THESE APPEAR IN THE SE SECTION OF THE SKY AT APPROX. 22:00 HOURS AND MOVES TO SW SECTION OF SKY BETWEEN 23:59 HOURS AND 04:00 HOURS.  IT DESCENDS TO A LOWER ALTITUDE AND CHANGES SHAPE.  I AND ONE OTHER PERSON HAVE WITNESSED ORBS CIRCLING AROUND HOMES IN OUR AREA, MOVING AROUND WINDOWS, AND ROOFS.  MY HOME INCLUDED.  HAVE CAPTURED TWO CELL PHONE PICTURES OF TWO DIFFERENT ENTITIES, BUT HAVE NO MEMORY OF TAKING THEM. HAVE ATTEMPTED TO CAPTURE AS MUCH AS POSSIBLE VIA CELL PHONE PICTURES AND VIDEOS. JETS SEEM TO SCARE THEM AWAY.  HAVE WITNESSED ONE DISAPPEARING COMPLETELY. I AM NOW EXPERIENCING PTSD. G! ENERAL LOCATION IN LOGANVILLE, HWY 78 AND HWY 81.",
"Observed an unknown object flying over a cloud that resembled a helicopter with no rotors.  On June 23rd, 2021 at approximately 3:15pm, in Solon, Ohio, I had an unusual and unexplained sighting directly overhead. It was a very clear and sunny afternoon with a lot of smaller low altitude clouds like stratus or cumulus(looked like cotton balls).  I was five to ten miles from the nearest airport, and there were small private planes in the area at the time of the sighting. I was standing in a parking lot when I heard what sounded like a low flying plane that was revving up. It sounded bigger than a Cessna 150 due to the high volume level, but I couldn't see it, probably because of the large building I was next to. That got me to looking around to see if I could spot it. I looked all around, then straight up.  Directly above me was one of those smaller clouds I mentioned. I'm estimating it's altitude at between 6 and 10 thousand feet. Approaching the cloud, not moving very fast, was an object that at first glance I thought was a helicopter. I say that because I could see no wings and it had the general shape of a copter, but more rectangular with kind of a military look. It also had a thinner trailing section that resembled a helicopter's boom. It moved in a straight line.  The odd thing is, I could not see any rotors. I was right under it and should have been able to see the main rotor spinning. At about the same time, the loud propeller sound I had been hearing started to fade, and I was listening for the signature whooping sound that helicopters make. I never heard  that sound. I continued to watch as the object actually flew over the small cloud and I continued to watch because I wanted to see it after it passed over the cloud. I must mention here that it was fairly calm and the clouds were moving slowly.  I continued to watch as I anticipated the object coming into view again. It was taking so long that I wondered if it was a helicopter that was hovering above the cloud. It shouldn't have taken more than about 15 seconds or so for the object to pass the cloud, given the observed speed of it going over.  I never saw it again, and I don't think I ever heard it. As I continued to watch, the cloud began breaking up and dissipating rapidly. From my perspective, it was as if the object just disappeared .  I have a lifelong interest in ufology, and was long ago convinced that they represent a real nuts and bolts phenomenon. However, I'm not convinced of their origin one way or another. I'm skeptical of a lot of stories I've heard and seen and I try to remain objective. I also have a lifelong interest in anything that flies, especially jets and rockets. I consider myself to be a decent observer when it comes to identifying aircraft, at least in general terms. I would like to know if anyone else has seen an object of the same description.",
We were traveling in Newton Township alongside the Hiawatha National Forest to Munising.  I saw a bright flash of light to my left.  I kept watching the sky.  My wife and I saw a disk shaped object with lights that would dim then get really bright.  It was hovering for a moment over the forest before floating on.  I picked up my phone and captured a video.  Not the best quality.  But you can definitely see it.,
"When I was sitting outside I've seened 6 glowing orange lights coming from JFK airport in the sky,not making any sounds all six of them,glowing orange,there was a helicopter in the sky not next to theses things at all,they were moving fast,when they reach my house towards the back of the house tree lethes they all disappeared just like that,wow,then 26 minutes later a plane was sent to investigate the area,don't know what agency?",
"Unknown bright object disappears in a cloudless sky  I was prepping my telescope to look at Venus and Mars.  As I was pulling the legs into place I looked up to make sure I was pointing in a good angle.  I glanced up higher because another bright object caught my eye.  It seemed to almost be hovering with no actual movement but I could be wrong on that, it could have been proceeding extremely slow toward the west.  It kinda had a glow to it like the sun was reflecting off of it.  I was waiting for the glare to stop so I could make out what it was, when it just disappeared, literally vanished. I hadn’t blinked and it was gone; it was just there and then it wasn’t.  I have never seen anything like this in my life.  I was in our atmosphere for sure, I am no good with distances so I could not give you a distance worth noting.  After standing in disbelief and confusion I noted a plane crossing much higher up to the right of the  object but it was leaving a contrail it was a passenger plane for sure.  Whatever I saw left zero contrail.  This happened against a stunningly clear cloudless sky. Still daylight but a setting sun.  I am an Evidence Technician for a local Police Station.",
"various pictures taken with stealth cam showing one object breaking into two objects sending light beams to the ground then going back  July 11, 2021 We have trail cams in the windows of our cabin to observe if there are any intruders lurking around when we are not there. We do not go to the cabin or check the cameras often but when checked seen pictures from July 11, 2021 that were unlike anything that we have seen. 7:15 PM – Land, water and clouds 7:26 PM - In the sky an Oval object with red trailing from the bottom 7:27 PM - Object changing shape from oval to a bigger round with smaller round to the side and the red trailing now to the left side 7:34 PM - Object now closer to the ground, larger round on top with smaller round attached to the bottom and emitting lightbeams to the water in the small cove 7:39 PM - Large round on top with smaller round separated emitting lightbeams to water in the cove a little further out 7:39 PM - 8:14 PM No pictures between that timeframe 8:14 PM – Sky very bright around the two objects that are still emitting lightbeams to the water in the cove a little further out 8:15 PM – Sky is still very bright with large round object and smaller round object getting closer together and are still emitting lightbeams to the water. To the left of the objects by the cloud looks a saucerlike object with 3 lights 8:24 PM – Objects are now one object and higher in the sky but still emitting some lightbeams to the water. Bottom left, above the treeline following behind looks like the three lights that were in the saucerlike object. Water now has a bright lights at the beginning of the cove where the beams were emitting. Around the nose of the cove is now a red light on the water. 8:35 PM – Objects are nowhere in sight July 11, 2021 the camera took 35 pictures between 5:48 PM and 9:10 PM which is an unusual amount as it takes only a picture occasionally.  I am limited to attach 5 pictures cannot attach all 8. The first 2 I have attached looks as if they are cropped when attaching and not showing object but should be visible if you are receiving the full picture.",
My friend and I arrived at Clearwater Lake for a fishing trip. I noticed a capsule shaped silver colored object across the lake in the western sky approximately 500 yards away. It was stationary for a few minutes while we unloaded the boat. As we began our take off it began to move toward the north. As we headed up the lake it continued that direction until it was out of sight. Never heard a sound as from any engine nor did I observe any way for the craft to move.,
"Bright light about 30 degree off the southern horizon that appeared to shoot up almost instantly.  At approx 12:05 pm on 11/30/21 as I was driving south on a road I drive everyday I saw a bright object about 30 degrees off the horizon. It looked almost like a streak coming off of it as though it was traveling west to east but as I saw it it wasn't moving. As I reached to try to grab my phone to take picture since I thought it was interesting enough to show the wife I saw out of the corner of my eye instantly shoot up and there was nothing left. At first I thought it might be a comet but since it appeared to go up I knew that couldn't be it and as I saw it there didn't appear to be any movement. Also there is a small to midsized airport about half a mile west from where I was, but the object wasn't near there and there is no small plane, or large for that matter, that could be gone in an instant like this appeared to. Also I know it wasn't Venus since I see that when I drive home from work everyday this time of year at about the same height off the horizon, but Venus is about 15 degrees to the west from where this was. Plus I've never seen it at 12 o'clock in the afternoon. To say this is a UFO only in the literal sense that it was unidentified to me, but it seemed odd enough to find a reporting sight.",
"The past 3 nights my husband and I have seen between an orange to a red glow light that appears moving erratically then disappears and reappears again this has all been at the same time at night 9:42pm mountain standard time. It moves fast stops then Slowly moves only to start blinking as it descents down and disappears then reappears in erratic movements almost as if it had landed and took off. Tonight May 2nd was a different story we saw the red lights again at 9:42pm due the routine. At 11:15pm mst we noticed a very bright white light off into the distance moving erratically the weird thing was there were vehicle light off to the distance from where these lights where. The strange thing about this the two vehicle lights turned into what appeared to be 4 vehicles that disappeared. There aren't any thing that would mask the ""vehicle lights"" they were lined up in a straight row almost as if the tail lights were pointed in our direction in which cas! e would be impossible for it was on a road not a parking lot. I believe this was an aircraft. This was not caught on tape as it wasn't picked up by cell phone video camera. My husband did say that for a brief time his video did see facial recognition.",
Stepped outside around 11:30 pm was looking south east and saw a faded triangle shape light fly from west to east at a very high speed no blinking light like I see on A plane  also that it flew in a path that jetliners do not fly,
Bright white beam shot towards me while floating white lit craft hovers 2 and a half feet above back yard.  It was around 1:00 in the morning.I woke up thirsty for a drink so I went into the kitchen to get some water when I noticed a strange white light through the blinds of my window facing the backyard. I set my drink down on the table while I opened the back door leading to the backyard. While I was walking down the concrete path that lead to the end of my back yard to take a closer look at what was going on I heard a foot step in the immediate vicinity. Obviously shooken up I made a b line towards the door which I exited only to be hit by this paralyzing beam of white light. Next thing I know I'm back in my kitchen sitting upright in my chair. All seemed normal until I looked at the clock on the kitchen stove and saw the time was 5:00 am. Not wanting to bring any unwanted attention to myself I decided to keep it quite for the rest of the school day until what happend next. Being a accomplished track runner for my high school I normally find it easy to not get ! fatigued or have anything unusual happen after I'm exhausted Today was unique in that after I felt absolutely sick to my stomich.I told my coach I wasn't feeling well and he let me go use the bathroom.As soon as I made it I threw up in the toilet but this was no normal looking vomit. It had a solid blue like texture and before I knew it this unusual bug like thing was sitting right there on the bottom of the toilet bowl before crawling down the pipe. I believe there was some type of experiment used on me maybe even containing the creature also known formally as the face hugger. Being the dumb guy I am i still considered to keep this to myself since anybody else would not belief me and think I'm crazy.I tried to get photographic evidence but the creature that came out of my mouth moved to fast. As of typing this I have never experienced such a crazy event in my life and still have trouble believing what happend to me. I can't explain why but I did not feel any fatigue at all! while running and was questioned by everyone why I didn't see! m exuast ed like the rest of the group. Whatever that was that came out of me must have left some type of effect that delays the exhaustion period after physical excersion.It is not my intent to spread false information and would never try to trick the person reading this into something thats simply not true. I just want to encourage anybody else that has experienced the same type of events that happend to me to not be afraid to pubically admit it before it is to late. The only power these creatures have over us is the ability to make us doubt our own memory. I hope everyone who is reading this does not have to go through the same events as I did and never have to come in contact with these horryfying beings.,
"Black Triangle UFO with Seven Dims Yellow Lights  Me and my parents traveled to SANYA,HAINAN ISLAND, South China Sea for a month-long vacation from April to May in 2021, the night we saw this object is at 7pm. (4.29), it was a quiet evening, only the faint calls of tropical insects, me and my parents were taking a walk at the street we lived in, my mom was walking in front of us, my dad was walking backwards, I was heading ahead, me and my dad were in a face-to-face position, chatting a little. After took a peaceful walk for a while, suddenly he said ""Why are these stars arranged so neatly?"" I look up right away, As if it found out that it’s been discovered, it’s moved towards us, i saw this black triangle object moved from 1km to 100m in 4 seconds to right above my head then moved away in 10 seconds over the tree top. The lights appears to Disguised as stars at the beginning, then when it came close i found it's changed it’s light mode into very dim lights in a few seconds. It’s not like any of the earth-made lights being: No light rhyme, extremely even and consistent light, no flash, very stable.regular circles, not an astigmatism-like luminous object on earth. The object cause No sound or air disturbance or any of that,the Movement of that object is smooth and easy, not like any of the terrestrial craft that will cause interference or disturbance of the air. It's even more darker than the sky, Its material composition is not reflective like earth-made metals. for my recall it’s about About 50 metres long or even bigger.Its existence seemed deeper than the background sky, Its edges are so sharp, then I realised its weight and texture at that time, sort of mixed texture, very heavy.. i still recall the lights that appears has embedded on it, the surface of its triangular row is not a coating or something, but a non-reflective metal material. This makes it more incredible to move quickly and smoothly without resistance. On the rest of the journey after its appearance, I thought day and night that now I can still go back to the scene at that time, and all the details are so clearly visible. The most incredible detail I can recall now is that the light has no radiance, just like the light solidifies in it.  This Object Moved From South To North. From the Ocean side To the Mountain side.  Here is the Longitude and latitude on Google Earth of the Place I witnessed this object : Google Earth Link https://earth.app.goo.gl/?apn=com.google.earth&isi=293622097&ius=googleearth&link=httpsearth.google.comweb18.23773602,109.63833375,11.80795215a,121.79790221d,35y,5.06542051h,22.68833021t,0r #googleearth complete post on reddit : https://www.reddit.com/r/UFOs/comments/t5vyn9/improved_version_drawing_of_the_triangle_ufo_with/?utm_source=share&utm_medium=ios_app&utm_name=iossmf",
"Fast moving light seen in early morning sky of Fort myers, Florida.  Morning of April 26, 2021, ~06:21-06:23  We were watching the setting moon of fantastic colour, reported to be the first super moon of the year. From this westernly direction we had been looking in, a fast moving light appeared.   We don't know the elevation or exact speed. It resembled closely what a satellite might look like if it was more relatively fixed in position.   It moved in an easternly direction, towards the the sun that had yet to rise.   At fist we thought it a plane, but it could not be any commercial or recreational aircraft judging by how fast it appeared to move. We did not hear or feel the sound barrier breaking. We considered the object possibly to be of military or Space X origin, but we, cannot say for certain.   The object soon disappeared within a minute or two. We were unprepared to do calculations of any sort.",
Small silver/white disk shaped object traveling in excess of 2-300 mph south of Kingman AZ  Small silver/white disk shaped object size of a normal car flying at excessive speed well over 2-300 mph with no sound heading north. Flying at low altitude approximately 1/2 mile.  I was recording a large approaching storm while driving southbound on I -93 near Mcgarrys wash. Only upon review of the video did I capture a 7 second clip of the ufo darting north.,
It was night and me and my aunt were looking at the stars and we saw these orange flares that were hovering off.  It was night and it was like 2021 I think and I was in my back yard.,
Very bright and pill shaped/horizontal flat  The object first went across with no jet streams behind it. Five minutes later it appeared going in the same circular routine. It appeared 5 separate times and would hide back and forth behind the clouds. Some of the appearances had the streams behind it like a jet. It was so bright like as if it was iridescent. It had no sound. Last time it came by it had a set of wings on each side .,
"We saw a light hovering that appeared to have another smaller orbiting sphere, it appeared out of nowhere and disappeared as suddenly  My wife and I were enjoying the sunset around 5:35pm on January, 31 2022 when we noticed a bright white dot in the sky. We were looking eastward toward a peak called Lone Peak in the Wasatch Mountain range. The only land behind our home is BLM land with no buildings or lights just mountain terrain and high desert vegetation so we had a clear unobstructed view of this. We thought it was a star at first but the time of day seemed too early for a star to be so visible and bright. We watched it for several minutes and observed that there appeared to be two dots with one stationary and the other appearing to orbit the other or move side to side either in front or behind. As the sunset progressed the colors changed on the peaks but the object just stayed in the same place so we had a pretty good idea that this object was stationary and not moving with the orbit or movement of the sky. We watched this for about 20-25 minutes then the lights got dimmer and two smaller lights appeared below the center object so now there were 3 separate lights lined up vertically and they all got dimmer and dimmer then disappeared. That’s all we saw and for the next 45 minutes we continued to look in the same direction hoping to see something else but only to see Orion appear in the night sky. It was great!",
"12 red lights in the sky low to the horizon in Paulding County, GA.  Riding in a car home from North Paulding High School I saw approximatley 12 red lights in the sky low to the horizon looking like they were at various heights in the sky. Some moved up, some down, and they all seemed to be moving in the same direction.",
A strange star that Vanished  we were outside letting the dogs do their business and saw a slow moving star like bright orb with one light moving slowly east through the sky toward mountain and not blinking. It continues slow and smooth. Watched for about ten seconds and the orb fizzled and changed to a reddish color and disappeared. No cloud clear night,
