reported,url
"Close encounter of the third kind mid 1980's  My close encounter of the third kind in the mid 1980’s  I decided to send in my story for a couple of reasons. First, because I almost died from a major heart attack last year that required triple bypass, emergency surgery on both lungs and kidney failure. I am still recuperating to this day. And second because I know what happened that night was real and I feel that it should be remembered and put on record. Please forgive me, I am not a writer and will do the best I can with telling what I remember as it was a long time ago. Dates and times are approximate but the experience is well remembered.  This incident happened around  midnight or a little later in the morning one night in 1984 0r 85. I remember being awaken by sounds that seemed like they were coming from the kitchen. Of course I was startled and did not know if maybe one of my young sons were in the kitchen or if it was a burglar. Also, I wasn’t sure what the humming sound was  that I was hearing and decided I needed to get up and investigate.  As I was going to pull back the covers to get out of bed, It was then that I realized that I couldn’t move. I was frozen as if I was paralyzed from head to toe! I tried to turn my head to wake up my wife. I couldn’t turn my head or even call out to her. I couldn’t even speak. The only thing I could move were my eyes so needless to say, I was pretty much terrified at this point.  We kept the vent light on above the stove so we, and our oldest son, could see and be able to get  down the hallway to the bathroom at night. As I was laying on my back and looking at the light shining on the hall wall, I noticed shadow movement that made me realize that someone, or something was in the kitchen and  moving down the hall toward our bedroom. Our sons bedroom was directly across the hall from ours.  At this point two of the beings walked to my sons opened door and looked in, without turning on the light, and one came into our bedroom. They were about four feet tall and looked like the grey ET’s that I’ve seen as described on TV since this incident. Then one who looked similar to the other three, except was about a foot taller, walked in followed by the two that were at my kids door a minute earlier.  Even though I didn’t hear anything except for the continued humming noise, it looked to me like they were communicating to each other and even using hand motions to each other. After moment of this, one of them walked to my left side, one to my right side and one to my feet. The taller one stayed back by the bedroom door. They held something like a scanner, about the size of a cell phone, holding them a couple inches above and went up and down my body, including my neck and head, for maybe a minute.  The last I remember from that visit was the three shorter beings following the taller one out of the bedroom and down the hall. The next thing I remember was being awakened by the alarm clock to get ready for work at daylight. Of course the first thing I wanted to do was ask my wife if she remembered anything that happened the night before but she was still asleep when I left for work. And though I wanted to, I was too scared of what people might think of me to tell anybody at work about what happened. When I told my wife about it after work, she couldn’t and wouldn’t believe any of it. That’s when I decided to keep it to myself. This is a TRUE story and it happened!",
"It was so short, it had to be real. It was unlike anything I have ever witnessed and I was not frightened.  I was sleeping on the floor next to my bedroom window at approx 11-13 years of age b/c it was so hot that summer night.  I somewhat forget because I was so traumatized as to my exact age and since I was asleep I cannot tell you the exact time of night it was.    A sound is what woke me up...I looked out the window to a bright blue-ish/neon-ish disk shaped --- UFO-- for lack of a better word. It make a whirling sound and hovered hundreds of yards away.  I was mezmerized.   I tried to to yell for my sister who was sleeping in the room below me (I was in the attic).  I couldn't talk or make a sound. I was frozen in my spot, but I was not scared.  And I can't even watch a scary movie or a horror movie.  Even deep dramas freak me out.    This is the last thing I remember.... until the next am; I told my mom and she didn't disbelieve me. I told her exactly what I said here and she said something along the lines of ""your story sounds like other's who have reported the same things..  And other people have said they can't speak after seeing an UFO,either""... strange but true.   ((NUFORC Note:  Witness elects to remain totally anonymous;  provides no contact information.  Witness does not indicate a date for the incident; we have no idea how old he is now.  Possible hoax.  PD))",
"Around 1am, I was standing on patio when I noticed light changing effect form a object hovering with a slight ascent.  Then what seemed to be 2 shooting stars came striking by towards tne object.  It slowly moved southwest.  I thought i was crazy till I layed down and I couldn't sleep as I was trying to wrap my brain around what it may of been.    Went back after a hr or so the object was now back but higher this time.  As i took pics and recorded till pbone died.  I noticed a smaller and light blinking.  Second object was hovering off the shore.  It seemed to be same allatatude as the first.  I saw then the 3rd one almost the same distance from the brighter object as the other.  They formed a perfect pryamid and they stayed that way till day break.  The brighter one had kept moving up then down in no manner known aircraft can do.   ((NUFORC Note:  Location and date of of sighting are not indicated by witness.  PD))",
"It has been a long time ago and I've tried to get help. It was early Saturday morning. I was going to Lansing iowa, was going duck hunting later.  Anyway, I was going around a curve when the sky lit up. It was south of me, a blue white tongue of fire, kind of reminded me of when you see a rocket land, how the flame come out the bottom. I could see this thing slowing down as the intensity of the flame increased. This thing slowed down to almost not moving and disappeared behind a ridge and trees. This thing was at least a mile away. It was big. Sorry, that's all I can remember. I did contact the Postville pice to inquire as to whether a plane crashed and was told no. I know I saw something. I'm a U.S. Air Force veteran, and because of my security clearance and the office I worked in, I've seen the real Blue Book!",
"A ball of light, lighting up my pitch dark room..  A few years ago,myself and a friend who was sleeping over,were chatting away in our beds. We had turned off the light and were talking in total darkness.all of the sudden,her face and the rest of my bedroom was totally lit up and we could see each other perfectly.we both jumped up with fright and looked straight out the window,where we saw  something that seemed to be a ball of slightly blue light hovering just outside my window. in distance it would have been near the middle of my garden and in height,just above the roof of the house.we froze as we looked at it and after about a good five to six seconds,it shot off extremely fast.we then were left in a darkend room again. Neither of us have any idea of what it could have been and we regularly wonder about it.My dad suggested it could have been a fireball,but it was totaly soundless. it's not like there's many people you can tell this kind of thing to,so i dont really bother(even though i want to tell everyone)but i would love to hear from somebody who could tell me what it could have been. the curiosity hasn't faded in the last few years and i don't think it ever will.  ((NUFORC Note:  No date provided by witness.  We have assigned an arbitrary date, such that the case will sort to the time period of ""a few years ago,"" but it is pure speculation.  PD))",
Moving light  Small star like light but moved erratically or in sort of zig zag motion. I tried to upload 3 videos I have as proof but system or button here for such not working my end.,
heard a helicopter flashing redlights and in front of it spaced evenly were 4 bright green orbs going east  before I could run outside to get a further look they had disappeared behind some trees. I wouldn't say the helicopter was chasing these just escorting them,
"beam of light caught on camera it took out power and made a sound  https://youtu.be/Qm_2zaSZljs  at 3:57am and exactly 15 seconds a ufo projects some kind of search beam and you hear the beam it makes when it hits the security camera so TURN UP the volume.... please turn up the volume! loud you can hear myself or my partner snoring a second before the power goes out  is there any other explanation for what was caught on tape?  in short, power goes out,my emergency light comes on which is red and can be seen in every frame after the power goes out .. a search beam outside my home and it appears the brightest point or spot was outside my bedroom window! nobody bloody elses  can anyone give an explanation of a human source? I uploaded all the video to youtube and I have the raw video from Xiaomi 360 cam I copied...  on battery backup is the camera (ir filter is turned off as you can't see crap with it on) 1 google mini and an emergency red light that is visible in every frame after the power out (black out)  also I felt tired for 5 days and all my smart devices all have the same strange fault!  please this is driving me slowly mad..... nobody responds to my emails! I'm desperate for answers....",
stagnent orange ball of light that went from small to big  i was woke up by a loud choppter/jet sound. looked out my window and there was a stagnent bright orange light in the sky. the sounds stopped then i could hear car alarms going off. the object seemed to be in one place. i woke my little brother up so i could make sure what i was seeing. so i took a photo and a video. you can see its in the sky as the street light posts are really low,
"An array of green pulsing light that condensed into a mass object  Headed to work as usual headed down Hwy 2, just passed the last house before you start heading up the east side of Stevens pass. As I approach the grade heading up Rayrock, an intense green light array appeared and started pulsing. It was just above the tree tops and probably was the length of a football field. The light was flat on the bottom, but it projected upward in an irregular pattern. Then it sudden condensed into a roundish mass of green light, and slowly traveled parallel with the ground. I had a visual for about 3-4 seconds, but due to the topography in that area it went out of sight. At first I thought it was a transformer that exploded but there is no overhead power in that area. It was crystal clear out and the stars where visible.",
"Ball of blue light falling slowly west to east in the northern sky  While sitting on the front porch facing the north, I noticed a blue ball of light in the sky traveling low over the horizon, from west to east disappearing over the horizon behind the mountain. The color stayed the same throughout the sighting.",
"Spotted a blue object streaking across the sky from north to south.  I was sitting outside my house as there was a prowler in the neighborhood and police had been searching, I have a very large open field across the road from my home and I was scanning the field for the prowler, suddenly I saw a blue oval shaped object streaking across the sky, this was not like any shooting star I have ever seen before and it was not high enough to be a shooting star, it was no more than a half mile up above the tree line it did not.make.any noise as it streaked across the sky, I knew it was not a plane or a helicopter because it was. moving to fast and it was blue at the front of it and it had orange/yellow on the back end of of it it did not have a tail like a shooting star and it was headed from north to south towards the straight of Juan de fuca it was.moving to fast for a drone and made no noise I could only follow it for a short distance because it disappeared behind the trees. I have never seen anything like this before and I know the difference between a satellite and shooting stars. It was a very bright blue color and it did not appear to be slowing or breaking up, I made a call to the local police RCMP west shore and made a report to them as well. Again it was very low in the sky and clearly was not something I have ever seen before",
Strange shaped object  Unusual shaped object in night sky moving erratically and changing colour from blue to red to white with bursts of red,
MADAR Node 53,
"Bright light fell from sky, numerous beings descended onto my roof via a shroud of clouds and I was violated sexually, lost 8 hours.  On March 7, 2022 I was sitting in my backyard in Jacksonville, FL and a white star-like light fell from the sky and a few minutes later a group of beings that seemed hybrid in nature descended on my roof. They flew upright holding a long whip-like devise that is red and white striped. It appeared to be tied around waist and somehow helped to generated the cloud covering. They have metal devices over their nose that connect to ear on one side.  The lights they carry are incredibly bright. Some carry a 3-pronged striped wand of sorts. I was approached from behind, something was put over my nose and mouth, I passed out. I woke up 8 hours later and while I felt euphoric I also had been violated in the rectum area which is not something I would have agreed to. I have been celebrate for 8 years. I also have strange bruising on left arm. One hole is from the nurse but the others cannot all be from a bandaide .  I have had experiences with unknown beings since 11/7/2021. Some are hollographic in nature, some look human, others are like nothing I have ever seen. I have been shot at since 11/7/21 with a device that flies from the sky, through our roof shingles, through the house and into my body creating small holes. I have burn holes that go through my new mattress. There are holes in various things. They also shoot something onto our walls that leaves two fine strands of fiber if steamed properly to view the dots they leave behind. Is it some type of surveillance?  I have also had peaceful encounters. Since this started our attic has been cleared of most all insullation and I hear movement that is much bigger than a rodent often. If this is a hoax or gaslighting then the source deserves an Oscar!  I have called the police many times and they Baker Acted me over it- everyone thinks I am crazy. I am not! Help. They were above my home again last night 3/16/22.  I have plenty of photos and video, but was not able to upload to phone.",
Just adding pictures to previous report,
"Spherical orb moving very fast with unnatural speed and varying brightness.  Myself (48), my oldest (22) and my youngest (19) had just gotten slushies for my youngest’s 19th birthday and were parked in a Costco parking lot. We were sitting in our car talking. My youngest was sitting in the back and noticed a strange light through the panoramic moonroof. At first he thought it was a star, but it moved. Then he thought it was a satellite, but it changed in brightness and direction. That’s when he brought it to our attention. By the time we started filming, it had already changed direction 5 times. It moved from a close distance to maybe a mile away almost instantly. It also would grow incredibly bright, fade, disappear and even strobe. In the video it was in the sky to the North, most likely over the Columbia river. It was moving at a speed and direction that would be impossible with our technology. It seemed to be between 100 feet and 2000 feet in elevation. Movements were very fluid and slow to lightning fast. After watching it for several minutes, it seemed to fade into the distance to the North which would put it at a speed of at least 3 times the speed of our aircraft. We see Coast Guard helicopters and local aircraft all the time. This was nothing like anything we had seen before. We had no doubt this was a UFO.",
Noticed a bright light like the sun coming up the it started to change colors from orange to red to blue to white then other colors was  Looked like sun was coming up at night color changed and looked up if anything like this had happened before and son seen images from other places . I don't know what it was but there was some thing there and the light was so bright I couldnt see any thing an made producing that much light . I hope that what ever it was has some form of explaination.,
"Daytime orb sighting, Littleton, CO  Bright orange-red orb flashing intermittently and differing brightness but on camera just appears bright white. Moved very slowly south and disappeared after 2 minutes.",
MADAR Node 73,
"Random light shows up moving strangely and no bright stars in sight.  I looked out the window and out of nowhere a random light pops out of nowhere. I quickly got up to look more carefully; I did freak out a little and woke my boyfriend up so he could tell me if he was seeing the same. The light looked like it was trying to stay in one spot but i could kinda see it moving around up,down,and to the sides like if it was trying to stay still. I knew this was an odd object because I’ve never seen anything like it in my location. The light was kind of glistening. I did start recording just a few seconds after realizing. I took separate videos but you can definitely tell that it’s moving. In the videos you can see a that theres a light post and in each video you can see the light that it moved positions. At one point i realized the light was kinda fading away and it would come back. I did start recording because after a while staring at it i was feeling dizzy and wasn't sure if i was losing sight. But in the last video you can see it fading and then disappear. And like i said there wasn't any bright stars in sight but just that light.",
MADAR Node 143,
Object appeared while streaming live.  I was watching a live stream from a YouTube follower and on the 0:40-0:50 mark of the video you can see a round object appear in the sky out of no where and shoot across so fast. Please take a look. I attached a photo but in the video you can see it more clearly. There’s a street right next to where she is streaming so you will hear car sounds.  https://youtu.be/4jwu09Q8rhk,
MADAR Node 22,
MA Shape: Cross Duration: 1 minute Characteristics: There were lights on the object  Object was seen hovering motionless until we had stopped vehicle in road where it then began to proceed over us  Object was seen hovering motionless until we had stopped vehicle in road where it then began to proceed almost directly above us very little sound could be heard and no recording flights were in the area. I have picture and video I was unable to upload. Please contact me for any more information,
"White and green blinking lights on each aircraft in the triangle  Driving down I 95 we saw triangle of 3 flashing stationary objects, we passed underneath it and they never moved in the sky as seen in video",
"While flying in a USN EA-18G @ 20k, we saw a large bright white glowing orb flying toward us, getting brighter on a collision course  My pilot and I had just finished training in the Boardman Target Complex MOA in Northern Oregon (near the Dalles). At 7pm Local time, we departed the airspace to the Northwest at 20,000' MSL, headed for NAS Whidbey Island. At approximately 705pm, my pilot asked me what the bright light at 10 o'clock was. I looked out and saw a large white glowing orb at what looked to be maybe 5-7 miles. As we studied it, it started moving on what looked like a collision course with us, and at co-altitude. It got about twice as bright during this time. We then asked ATC for a climb to 24k because we were worried it would collide with us. We received permission to climb and described the position to ATC as we were looking at it, but ATC said they had nothing visible at all on radar. After ATC said that, the craft seemed to drop quickly below the undercast cloud layer at 18k below us. We did not see it again after that.",
"Saw a Square craft blinking green and red  Hi there, this video is from Nanaimo BC Canada , March 8th at 8:00 pm. My husband called me outside on the deck because this flying thing came out of nowhere zig zagging in the sky until it stayed in one spot that we could see from our back deck and I started filming. It’s hard to tell in the video but it was blinking red and green and was very large and square , as it was far away from our house. Sorry the video is very grainy as it was at night and I zoomed in as much as I could while filming. Thanks",
"Not sure what I just seen  I love the night sky and have a very high iq. So Don't think I'm some crack pot looking for attention. I wish to remain Anonymous. But I was outside looking at the clouds wondering if it was going to rain. Seen a light and thought it was a star. Then realized it couldn't be. Light did not move at all. Started to strobe then stopped. Proceeded to dim, then was just there. Blinked and it was gone. Red, orange and white. The gps is approximately where i place it. The hill next to where it was is 4400 feet. And it was just left of the peak and tower. Looking from Dalton Gardens Idaho",
I saw aol portal in the sky open up and 10 spacecraft fly out of it  I was sitting in my car and the inside of it lit up blue. That's when I looked up and saw the blue orb in the sky trying to open. I grabbed my phone and started recording it. I could see the blue orb open up and the swirling vortex around it. Then 10 bright lights came out of it. They hovered for a couple of seconds and then took off in a blink of an eye in different directions across the sky.,
Very strange colored lights seen moving fast over lake ontario  I was on my ribs inflatable dingy heading out of the Port of frenchmans Bay at around 930pm.While looking south over the lake I first saw an orange glow almost like a flare. Then 5 minutes later at about 20 NM distance I saw a similar light moving at a very high rate of speed heading to the west. It changed colors from white to green then blue and purple all very quickly all in a moment. This thing moved fast and upon looking at Google maps covered a distance of 5 or so NM all in an instant. Nothing know of moves that fast. The colors changed as it got faster and faster. Then it was gone. I did get a picture but it's unusable. Very strange definatly not an aircraft or flare but rather something strange.,
MADAR Node 178,
"Recorded and stored on Ring Camera Cloud  Item on attached video appears 5 seconds after my wife re-enters the house with our paper. Object clearly was very small, high speed on a horizontal trajectory when it made a sharp immediate 90 degree upward course. Object could have been much larger and farther away. Blow up photos of object (included) on plume2.jpg, shows square propulsion emissions that do not dissipate quickly. Bottom of object is slanted and one of the enlarged photos show a perfectly square emission port that appears to be maneuvering the object. No visible fins, feathers or wings. Blow up clearly shows that it is tot a bird, insect or fireworks. The original video is on my Ring cloud site, and I do not know how long they will store it. If you want additional information, leave a email me or leave a message on my home phone answering machine as we do not answer unknown phone numbers due to rampant telemarketing",
MADAR Node 143,
