reported,url
"We saw a triangle of lights moving very fast in the sky.  At around 1:05 AM my girlfriend and I were looking up at the stars and thought we saw a shooting star. We both saw 3 lights in the shape of a triangle moving at a very fast speed. We checked Flight Aware and there were no aircraft nearby. It was also too high and too fast to be a quadcopter drone. There were no nav/strobe/or beacon lights that would normally be on an airplane. Altitude is unknown, but was above 4,000 ft MSL. Craft was near the Daytona class C airspace and the Orlando class B airspace where transponder and ADS-B is required.",
They are here controlling people  Saw ships. Then started getting really bad head aches then started hearing them. Then seeing them then they came to my motel room and was communicating with me. Put visions in my head about my family and I that came true in less than a year. Orbs in my trailer around me a lot. Once a week or so. They can block people's vision and memory. I have lots more they won't leave me alone. I need help,
"It was completely dark and at first the object looked like a star; then I zoomed with my phone and I saw it moving in a circular way.  I was on the balcony at 4am; it was completely dark, clear sky, and I saw a circular object moving. At first it looked not moving, then it did a sort of infinite sign; then it moved in circles. During my recording It appeared another one close to it; Please see the videos.",
"It’s filed on iPhone off flat screen over Tetons  I’m in my kitchen in lake Jackson Texas. We have a flat screen on the wall that we turn on to watch wildlife and snow in the Jackson Hole Wyoming area. I had just turned the tv on and a huge fireball flew over the Grand Tetons, I took a video of the event on mr phone. The size of it was huge. It was still dark over the Tetons so you can see the event. Wanting to see if anyone else seen this.",
There are 6 strange flying objects that appear in a video I recorded. They’re movement was irregular & they glowed at times.  The objects that I saw were only visible through the camera but not to the naked eye. They’re not orbs from light. They change shape and sometimes we’re glowing. They appeared and disappeared back and forth. Sometimes they were blurry but I was able to capture a screenshot that shows all 6 of them clearly. I have a video and a screenshot from it that I can send you.,
"Driving on the highway- I saw a teardrop craft that crossed the length of the sky in less than 2 seconds.  I’m a skeptical believer. But I’ve never seen anything that defined a phenomenon until earlier this year. Driving home from Canada, my boyfriend was driving and I was looking out the window at the sunset. I caught a craft that managed to cross the entire sky in under 3 seconds. The craft was cone shaped with lights on it, and was approximately the height and distance of a landing plane. The speed was what was shocking. I’m a scientist, and the speed that this craft crossed the sky and disappeared was bewildering. I was in shock for a few minutes after. I knew it couldn’t have been any sort of man driven craft due to how fast it was going, and it was a miracle I saw it. I was completely sober and wide awake as well. Even though the sighting only lasted seconds, I can visualize every detail.",
Stars or drones?  Every night when the stars are shining on a clear night anyone can point a led flashlight or green/blue laser at them and within seconds they will start fluttering around like a balloon that tied to something. They stay within a close area from witch you get it to move from.70% of the stars visible I have made move around and shown lol to s of ppl. I would like to know a re e we living in a simulation? Or is a sky cloak for protection? I've had large drones or airplanes start flying big circles above me after shining lasers the object soon after starting but still have not met any men in black face to face wtf is in our sky!?! 360-((deleted)) leave message are text please,
Bright ball of light  I was on my way back from the store and I pulled up in the driveway I noticed I have something following me I looked up and it's the big ball of bright light it's like it's always there I noticed it first 3 years ago sometimes it follows me sometimes it doesn't but most of the time it stays above my home to the right of it just a little it's always there I don't know what to do I don't know what to think I'm sure to be there again tonight I'll get back to you guys and let you know I got pictures too I'm fixing to post them,
Light bar / Cigar shape  12/2/21 at 6:24 PM cigar shape object light bar traveling north east. Object appeared in the city of Garden Grove CA for at 10 to 15 seconds.,
"i walked out on my deck to watch the skies like i do every night that time and I immediately noticed 3 very bright lights in a line  i have a video of the incident. there were 3 very bright lights in the night sky, way brighter than the stars, and they were lined up in a perfectly straight line. they looked as if they were blinking or the lights were going in and out of view, not in harmony. they sat there until i went inside and it freaked me out for days now. I routinely go outside on my back deck and watch the skies at night waiting for sightings and this was outside above my house. i have it on video. i know my view of the sky very well and this was never there before which prompted me to start recording. to reassure myself that it was one giant craft or three individual craft, and not orions belt, I have been monitoring the exact position of the sighting every night at the same time and what i saw has not returned and cannot be found in my sky anywhere since the sighting. very strange. while looking in its direction my vision felt distorted like the image was wavy as well. blew my mind. my dog began acting very strange and barking and hiding under the deck table as well. hes a huge dog too. he was freightened.",
"I witnessed a cigar-shaped light slowly travel over my head before disappearing.  I just got home from work and was getting out of my car when my attention was initially grabbed by a bright shooting star that I saw in my peripheral vision to the north-west. I looked up and saw another unusual light to the south-west which I then turned to look at. It was a big bright cigar-shaped light. It was travelling slowly and steadily in a roughly north-eastern direction. I have lived near an airport for over 30 years and am used to seeing airplanes and drones but it was immediately clear that this was something that I hadn't seen before. It was a thick line of light. It did not blink or change. It made no sound. I stopped what I was doing to look at it. The sky was clear.  I pulled out my phone to record a video but later discovered, to my great disappointment, that it was in picture mode instead of video mode so all I got was one blurry photo. The object was very bright and to my eye it appeared larger and had a haze around it, giving it a halo effect, which was not captured in the picture my phone took. Interestingly the picture also captured a second oddly shaped light which I did not notice myself at the time.  I estimate that the object was visible for between one and two minutes. It slowly travelled in a straight line. If straight up is 0 degrees then I observed it from about 45 degrees to the south-east until it was about 15 degrees to the north-west, travelling not quite over my head but a bit to the north of me. Then over the span of about 15 seconds the light slowly and steadily faded out. It seemed like an oddly long time for the light to dim. I continued to watch that part of the sky for another minute. The object was big enough that I felt that I should still be able to see it even without the light but it was as if the object itself had faded away.",
It was a bright light that stayed beside my cat for about 10 minute then disappeared. About 10 minutes later it was in front of me  The bright light followed my car for about 10 minutes. After that it was on the side of my car and then disappeared abruptly.. After about 10 minutes it reappeared again in front of my car and stayed in the same position. It was very bright and circular. I got out of my car and took a picture and when I got home and zoomed n you could see that it was man made and there were little circles all around the outside edges edges. I screenshot the zoomed in photo and attached that too . This happened on Highway 260 between Springerville and Pinetop in a dark secluded area near Sunrise Ski Resort.,
"Bright white cigarette shaped silent craft moving north fairly slowly, it was slender with flat ends, not rounded.  There were no lights, there was no trail, no wings, no sound. Just a solid white slender cylinder. It was dark outside and the craft may have been glowing white, or just reflecting the sun from beyond the horizon.",
"Green cylinder shaped UFO early December in southern Utah  I know this is a little older but I hope the data might help. I was heading home evening of December 2nd from just east of Kanab Utah, a little after 6 p.m. I'm not 100% sure on the timing I'm using the timestamp of my photo for the exact moment I realized it was a UFO. Oddly enough though it was this thing was very bright and huge. However absolutely nothing appears in my photo. Anyhow, somewhere around 3 to 5 Mi before Highway 14 headed north on 89 I noticed a green comment. Which really stood out to me because I have red green Vision, most every light in the sky just looks yellow to me. As I came closer to the junction it fell out of my view oh, because of some Knowles, for a moment and I didn't see it again until I was heading west on 14. As I drove up the hill near an area we call Elkridge on the 14. I saw the comet again and it seemed bigger, later I realized I may have witnessed it entering our atmosphere. Anyhow, as I traveled further west on the 14 hi kept looking up at it and it seemed to get larger and larger. As I approached the Duck Creek area traveling around 50 miles an hour it went from a comment do a thick green line. To me it seemed like the size of the object kept increasing. I assumed that meant it was coming down. As I passed through Duck Creek Village I began to notice that it was not a comment. So I started driving a little slower to keep my eye on it. Just west of Duck Creek Village is a little pond. Maybe a hundred yards west of that pond is where I decided to pull over. In fact I was so stunned I believe I stopped in the middle of the road and then a second later realized I had better pull off to the side. My photo may even have GPS coordinates on it I will check. At this point it still seemed very high in the air. So I pulled my camera out, cell phone, and decided I was going to try to get a picture when I looked up to get a picture it seemed as though it had come much further down in altitude and was hovering above me. So I snapped the photo not realizing that my flash was still engaged. I looked at the photo and there was nothing in it so I hurry up turn the flash off reached up with my phone to get another picture, but it was gone. I believe it was heading north. A co-worker told me that his wife saw the same green comment as she was heading back from Richfield and to her it appeared to be over the Panguitch area which is north of where I was at 7:25. She said she saw it at around 9:15. The UFO / object was huge I couldn't even begin to tell you how big. Enormous is all I can say. It was lime green, and very long with what was either a dark colored or black band around it towards the front. Maybe one quarter of the vehicles length behind the front. If that makes sense. I am terrible at writing so if you want better explanation feel free to call. I left my name and number on the hotline. Andy, 435-590-6775. Here in southern Utah is not uncommon to see weird things in the sky. I have several incidences that left me wondering, what the heck was that. But this was the only time I could definitively say I saw the real thing. A UFO.  My second youngest brother and I also have a very strange Experience which happened when we were teenagers visiting our uncle in Kanab Utah. I'll keep it brief, about the middle of the day we were stretching with each other. Maybe less than two feet apart. Clear skies and no weather yet a bright orange light enveloped the room we were in. So bright we couldn't see each other. Less than 2 feet apart. My brother was so terrified I did not run outside to see what it was. This experience was around 26 years ago. Don't know if you'd be interested but I wouldn't mind telling about that one too.",
"Horizontal String of lights 800-1500 feet up.  At first glance, I though it might be a small passenger plane with all of the windows screens open, but there were no other lights (on wings or tail), and it didn't move like a plane. Moved slowly traveling North. I took my phone out to video it and it then went strait up and lights faded away slowly.",
"The object was cigar/pencil shaped, and was glowing yellow with what appeared to be a line of discrete solid yellow lights.  At the date and time indicated above I saw a cigar shaped object in the night sky around 7:30 pm. It was fully illuminated in yellow. It moved silently about 45 degrees from the horizon and moving east northeast at about a 15 degree climb. It was only a few seconds that I saw it. No time to grab a camera. It seemed to nose up and then faded out completely and disappeared. It was like nothing I’ve ever seen before. This is in Phoenix AZ, and was over a Sky Harbor Airport flight path, so maybe was caught on radar? I was in the military and recently retired as an engineer. It was not a conventional aircraft, flare, helicopter, meteor, kit. It was a cloudless, clear, still evening and no lightning was present. the object was totally silent, and moved in a deliberate steady trajectory. When it disappeared, the lights seemed to 'dissolve' into nothing. I was in my backyard and just happened to look up and see it. There was no time to grab a camera.",
Looks like dominoe  I took a photo of the moon and saw this ufo that looks like a black ufo with ten green lights where the dots go,
"Boomerang, no lights, silent  Tonight at approximately 8:30 while looking up at the stars, I noticed a dark object moving through the sky. It was difficult to estimate distance and altitude. Though, I would say it was maybe at the altitude a helicopter flies. There were no lights or sound. It was moving at a speed consistent with a helicopter. My sighting lasted only about 10 seconds. My best estimate of the shape was something like a boomerang. It moved through the sky very smoothly unlike the flapping of a bird’s wings. Though I imagine if I misestimated the altitude, it’s feasible that it was a large bird gliding. After discussing it with a third party with pilot training, it was also mentioned that it may have been a B2 bomber.",
"Huge stationary yellow/orange orbs in triangle formation  Last night I witnessed something very, very strange. Around 7:30 p.m. I looked southeasterly out into the night at the ocean and see 3 huge yellow lights forming a slightly obtuse symetrical triangle of the size range of a football field to 2 football fields, lighting up in unison and making no sound or movement then in three or 4 seconds completely disappear in unison. Super big, quiet, suspended perfectly in midair and possibly being a quarter mile to a couple miles away and maybe half that in altitude above sea level. I have never seen anything like it. It was surreal. And then what appeared to me to be a military plane flew in from the south, which I captured on video, right through the airspace of the 3 huge mysterious triangle of lights. Then after it has passed a single light identical to the 3 that formed a triangle suddenly appears (not moving - my camera moves to catch it) for a few seconds, which i also capture on video (yay!!!!) and then disappears. Then it returns in the same spot for a second then disappears again. It wasn’t a drone. It was huge and suspended in the air perfectly like a hummingbird. I was super excited to witness this extraordinary event. Then more (military?) planes fly in and zigzag around the area of the unidentified other worldly lights. Later, while on the phone with Deborah I look out and see them again. I quickly ended the call and tried to video it but wasn’t successful before they disappeared again. Extraordinary. Then later still I was texting with a friend about this and she sends me news clippings of similar sightings in this area. Turns out Myrtle Beach is a UFO hotspot. Yay!!!! This video shows the blinking lights of the plane that flew in after the sighting, then a single UFO light appearing and then vanishing, and then reappearing and vanishing again at the end of video. — in North Myrtle Beach, South Carolina.",
"Cigar bright light in the sky, disappeared.  Every night this week a bright light has appeared in the sky by 7 p.m. and disappeared by 7:55 p.m. I originally thought this bright light was a planet at first appearance, but when it disappeared I question otherwise. Every night I went outside and this occurred between 11/29/21-12/2/21. Tonight, when I noticed that incredibly bright light disappear, I looked adjacent to where the light was and saw a cigar shaped light that I filmed for 7 seconds. It was there at least 10 seconds before I figured out how to use my camera and it disappeared as if it faded behind nonexistent clouds in the night sky.",
UFO highway trail  As I was driving I saw 3 lights in the sky just above the clouds not really thinking much of it until each one individually started to shut off. As I kept driving just over the bridge where the fox river runs at the corner of my eye I see a large object with 3 lights triangular shaped speed through sky in one direction from one end the river above the clouds to the other end heading towards Green Bay. Seconds after 3 more object each large in size with 3 triangular lights speed bolt following the first one in tight formation in the exact same direction as if it where following it one after another. It almost looked like you where sitting in your car driving at the same time and slowed down watching these object on a highway trail in the sky. Its like nothing I have ever seen in my entire life. I literally got chills when I saw these object go super fast in the sky because now I believe and not sure what the Fuc$ it was. This has forever changed my life and now I am not scared to say what I saw.,
MADAR Node 156,
"Line of lights, 50+ crafts, moving west to east. Seen directly south when we came outside, then as it was to our southeast, the line started to disappear from the front most craft to the rear. Can't upload photo from my phone to the drop box below, but I do have 2 photos",
"A stationary bright light that changed to blinking red/green on the corners before zipping away.  First there was a brilliant starburst shaped white light. I had no idea what I was looking at, couldn’t come up with any logical explanation. It appeared stationary but from my perspective it could have been moving toward me and I wouldn’t have been able to tell. Then all the light went out and was replaced by green blinking on the corners as it quickly zipped diagonally to the forward left (moving toward me) and then out of my eyeline. Which I know sounds like a plane but for how quickly it changed direction and moved across the sky in relation to how close it was to me and to the ground, I just don’t think it was. Too big to be a drone, it was silent so not a helicopter. Saw it out of my 3rd floor window at 6:06 AM EST, unobstructed view. It was higher than trees but not significantly. When it moved to the forward left it was probably within a mile radius of me, but I’m not an expert at gauging distance.",
"I saw craft exit portal/vortex  while fishing offshore I saw unusual rectangle shaped silver/gray cloud, then 2 teardrop shaped clouds dropped down from each bottom corner of rectangle. then vortex shaped cloud shot up from center top of rectangle cloud with star like object on top of vortex. vortex was spinning in clockwise motion. vortex remained, but object at top disappeared. then large cloud of vapor or mist erupted from the face of the rectangle for about 1 minuet. vapor stopped coming out of rectangle, but vapor remained in place. perceived movement in vortex from top to bottom. lasted several minuets. craft rode up thru vortex and about 150 to 200 feet above vortex. craft turned north, then west and then south southwest. portal disappeared, but vapor and the two teardrop shaped clouds remained. craft had arrowhead type appearance on nose, back part of craft cylinder shaped. about three fourths the length of 747. nose of craft morphed into same shape as rear so all was cylinder shape. bottom of portal never touched the ocean, and was about 50 to 75 feet above surface. after event ended I had a feeling of peace and calmness like nothing I ever felt. that night my teeth were very sensitive to hot (not spicy) food-first time that happened.",
"Observed a silvery object for 10 minutes about 8 miles SSE of my home, just E of the (LAS) Airport  4:15 pm 12/03/2021 while stand in the back yard with my neighbor, he points up in the sky and asks what is that? We live under the approach and departure area of the McCarran airport, I thought he was  referring to another type of aircraft. But this was no aircraft it was a long cylinder or cigar object bright white and silvery looking. The orientation of the Cylinder like object was vertical, the ends up and down  and it appeared to be hovering southeast of the airport. There had been air traffic departing in that area. I thought we would wait to see another aircraft pass by the area where the object was situated and gauge the size and altitude of it. But it seems at that moment all the aircraft that were departing had been diverted from that general area. There were two aircraft that had changed course and headed north east away from that area.  then all air traffic for 8 to 10 minutes seem to have been  stopped. About 10 minutes later an aircraft that looked like a C-20 in dark green paint was seen coming from the direction of the McCarran airport heading toward the object in the sky. The aircraft seem to have gotten about 1 mile from the object when it just winked out of sight. The aircraft passed through the area where the object was seen and continued on out of sight about 3 minutes later. I snapped a picture of it. Didn’t think it would come out because of the distance about 5 miles out. But when I enlarged the image I was surprised to see an image of a tic tac shaped UFO like the ones seen in the news recently. Image 1 is the actual photo taken , image 2 is an enlargement of 1, image 3 is an enlargement just after the the object vanished. Image 4 is map of area and approximate location of sightings.",
