reported,url
"Posts Data Bank Gallery File a Report Donate About Us Toggle website search  	 		 		  			 											 												 								 							 								 Menu 				 Close 						 							 				 			 	 		 Posts  Data Bank  Gallery  File a Report  Donate  About Us  Toggle website search  	 		 		 			 		 					  	  										 						 						 				 						 														 																															 		 			 	 		 722 New Reports Posted 	   								 Post published: July 10, 2023 																										 Post comments: 0 Comments 			  	 The NUFORC databank has been updated with the posting of  722 new reports , received via our Online Report Form since our last update on May 19 th .   489 of these reports are contemporary sightings (since May 19th), and the rest are events from the past that witnesses are just now reporting.    Beginning with this posting, we have added a section to each report for explanations, which appear on some reports at the bottom.   Our list of explanations include Aircraft, Balloon, Bird, Blimp, Camera Anomaly, Cloud, Contrail, Drone, Fireworks, Flares, Hoax, Insect, Laser, Meteor, Planet/Star, Rocket, Satellite, Searchlight, and …   	 	Continue Reading 722 New Reports Posted  					 	 																																	 		 			 	 		 SkyWatch Passive Radar Network for Citizen Disclosure 	   								 Post published: June 22, 2023 																										 Post comments: 8 Comments 			  	 In 2004, Peter Davenport proposed a method to to build a UFO detection system utilizing passive radar, and presented his ideas in the MUFON UFO Journal.   Now, almost 20 years later, Mitch Randall, working with the  Galileo Project  at Harvard, has built a working prototype and proven the concept.    The next step is to secure funding to produce a commercially available unit that anyone can buy and install.   When at least 3 of these systems are deployed in any given area, what Mitch calls Objects Outside the Paradigm of Science (or OOPS), can be detected.   These are craft that can …   	 	Continue Reading SkyWatch Passive Radar Network for Citizen Disclosure  					 	 																																	 		 			 	 		 Fighter Jets Circle UAP in Michigan on June 3 (Updated June 22) 	   								 Post published: June 6, 2023 																										 Post comments: 19 Comments 			  	 NUFORC receives 10 to 20 UFO reports each day.   Our standard procedure is to review and post these reports in batches, however we felt the following incident was significant enough to release ASAP.  On June 3, four witnesses observed what was described as an aerial “dogfight” between 2 jets and a UAP over a Meijer’s grocery store in Bad Axe Michigan.  Here is the report:  Quiet afternoon no signs of planes it’s, 10 am, in the parking lot of the storage unit across from Miejers. Myself, my wife and 2 Co workers were helping move my camper! Suddenly ear shattering  …   	 	Continue Reading Fighter Jets Circle UAP in Michigan on June 3 (Updated June 22)  					 	 																																	 		 			 	 		 522 New Reports Posted 	   								 Post published: May 19, 2023 																										 Post comments: 10 Comments 			  	 The NUFORC databank has been updated with the posting of  522 new reports , received via our Online Report Form since our last update on April 9 th , 2023.   We would like to take this opportunity to express our gratitude to those individuals who have been kind enough to take the time to compose a detailed description of their sighting(s), and who go to the trouble of submitting those sighting reports, using our report form.  In our opinion, those people who document their sightings in that manner are the true heroes of ufology!  Peter Davenport, Director of NUFORC, will …   	 	Continue Reading 522 New Reports Posted  					 	 																																	 		 			 	 		 333 New Reports Posted 	   								 Post published: April 9, 2023 																										 Post comments: 15 Comments 			  	 The NUFORC website has been updated as of Sunday, April 09, 2023, with the  posting of 333 new reports,  received at our headquarters prior to midnight (Pacific Daylight Time), Saturday, April 08 th .  Traditionally, we proofread each report before clearing it for posting to our website.  However, given that we are under time pressure to get this update posted, we have been able to do only a cursory job of screening and correcting the posted reports.  We close by wishing visitors to our website a Happy Easter, with hope that mankind will be able to set strife aside on …   	 	Continue Reading 333 New Reports Posted  					 	 																																	 		 			 	 		 1275 New Reports Posted 	   								 Post published: March 6, 2023 																										 Post comments: 2 Comments 			  	 We have just released  1275 new reports  received at the Center since late December.   The reports consist of a wide variety of sightings, from structured craft, to lights moving erratically in the sky, to frequent sightings of mysterious orange or blue “orbs”.    Conjunction of Jupiter and Venus  Reports spiked heavily in late February and the first few days of March when Jupiter and Venus appeared just 1/2 degree apart from each other in the western sky, a rare and spectacular astronomical alignment.   Many witnesses mistook this as a single craft, and reported it as such to us both over the …   	 	Continue Reading 1275 New Reports Posted  					 	 																																	 		 			 	 		 The MADAR Project 	   								 Post published: January 25, 2023 																										 Post comments: 2 Comments 			  	   Those of you who diligently scan our reports have likely noticed references to MADAR nodes, for example  this report from May of 2022 .    MADAR stands for Multiple Anomaly Detection and Automated Recording, and these reports document alerts triggered by a network of special sensors placed in strategic locations around the globe.    The sensors are designed to detect electromagnetic and ionospheric disturbances that may be caused by UFOs.  The project is unique in that it uses a scientific approach to collecting data and analyzing it, rather than relying on anecdotal evidence. This has led to a high level of credibility …   	 	Continue Reading The MADAR Project  					 	 																																	 		 			 	 		 1255 New Reports Posted 	   								 Post published: December 22, 2022 																										 Post comments: 12 Comments 			  	 The NUFORC website has been updated as of Thursday December 22, 2022, with the posting of  1255 new UFO sighting reports , submitted to our Center since mid-October of this year.   …   	 	Continue Reading 1255 New Reports Posted  					 	 																																	 		 			 	 		 Multiple Pilot Sightings Over the Midwest 	   								 Post published: November 8, 2022 																										 Post comments: 27 Comments 			  	 REQUEST DIRECTED TO ALL AIRLINE PILOTS AND COCKPIT CREW MEMBERS  On the morning of Monday, November 7th, NUFORC received a seemingly quite credible report from an airline 1 st  Officer, who reported having witnessed, together with the aircraft’s pilot, a very dramatic display of lights over the Midwestern United States during the prior evening.  Moreover, several other flight crews allegedly reported the same event over their backchannel, so-called “guard,” radio frequency, and apparently discussed the event extensively over the course of an estimated 20-25 minutes.  If any person who is reading this advisory statement was witness to a dramatic sighting …   	 	Continue Reading Multiple Pilot Sightings Over the Midwest  					 	 																																	 		 			 	 		 NUFORC Featured in Seattle Times Magazine Article 	   								 Post published: November 2, 2022 																										 Post comments: 0 Comments 			  	 The National UFO Reporting Center was recently visited by Erik Lacitis of the Seattle times, who wrote a nice piece about it for the October 14 edition of Pacific NW Magazine.   Check out the  full article here .…   	 	Continue Reading NUFORC Featured in Seattle Times Magazine Article  					 	 																						 							 Older Posts  → 												 					 			 		 					 		 		 		 							 				Copyright 2023National UFO Reporting Center,P.O. Box 700, Davenport, WA 99122-0700       TERMS OF SERVICE      PRIVACY POLICY 			 				 	 	 	 		    var scriptParams = {""google_search_engine_id"":""""};    var oceanwpLocalize = {""nonce"":""fb508dccb2"",""isRTL"":"""",""menuSearchStyle"":""drop_down"",""mobileMenuSearchStyle"":""disabled"",""sidrSource"":null,""sidrDisplace"":""1"",""sidrSide"":""left"",""sidrDropdownTarget"":""link"",""verticalHeaderTarget"":""link"",""customScrollOffset"":""0"",""customSelects"":"".woocommerce-ordering .orderby, #dropdown_product_cat, .widget_categories select, .widget_archive select, .single-product .variations_form .variations select"",""ajax_url"":""https:\/\/nuforc.org\/wp-admin\/admin-ajax.php"",""oe_mc_wpnonce"":""07566153f6"",""stickyChoose"":""auto"",""stickyStyle"":""fixed"",""shrinkLogoHeight"":""30"",""stickyEffect"":""none"",""hasStickyTopBar"":"""",""hasStickyMobile"":""""};",
"Posts Data Bank Gallery File a Report Donate About Us Toggle website search  	 		 		  			 											 												 								 							 								 Menu 				 Close 						 							 				 			 	 		 Posts  Data Bank  Gallery  File a Report  Donate  About Us  Toggle website search  	 		 		 			 		 					  	  										 						 						 				 						 								 	 				 									 						 					 			 								 				 			 /*! elementor - v3.14.0 - 26-06-2023 */.elementor-heading-title{padding:0;margin:0;line-height:1}.elementor-widget-heading .elementor-heading-title[class*=elementor-size-]>a{color:inherit;font-size:inherit;line-height:inherit}.elementor-widget-heading .elementor-heading-title.elementor-size-small{font-size:15px}.elementor-widget-heading .elementor-heading-title.elementor-size-medium{font-size:19px}.elementor-widget-heading .elementor-heading-title.elementor-size-large{font-size:29px}.elementor-widget-heading .elementor-heading-title.elementor-size-xl{font-size:39px}.elementor-widget-heading .elementor-heading-title.elementor-size-xxl{font-size:59px} Image Gallery 		 				 				 				 			 /*! elementor - v3.14.0 - 26-06-2023 */.elementor-widget-text-editor.elementor-drop-cap-view-stacked .elementor-drop-cap{background-color:#69727d;color:#fff}.elementor-widget-text-editor.elementor-drop-cap-view-framed .elementor-drop-cap{color:#69727d;border:3px solid;background-color:transparent}.elementor-widget-text-editor:not(.elementor-drop-cap-view-default) .elementor-drop-cap{margin-top:8px}.elementor-widget-text-editor:not(.elementor-drop-cap-view-default) .elementor-drop-cap-letter{width:1em;height:1em}.elementor-widget-text-editor .elementor-drop-cap{float:left;text-align:center;line-height:1;font-size:50px}.elementor-widget-text-editor .elementor-drop-cap-letter{display:inline-block} 				 While detailed photographs of UFO’s remain stubbornly elusive, many witnesses have submitted drawings or computer renderings of the strange craft they have seen.   Below is a collection of some of the more interesting images we have received over the years.  The images are presented in the order they were received, with the most recent at the top.   Each image can be clicked to see a larger version, along with a link to the firsthand report of the incident.   We will update the gallery with new images we receive each time we post new reports. 						 				 				 				 			 		 				 					 		 							 		 							 			  							 					 			 		 					 		 		 		 							 				Copyright 2023National UFO Reporting Center,P.O. Box 700, Davenport, WA 99122-0700       TERMS OF SERVICE      PRIVACY POLICY 			 				 	 	 	 		       var scriptParams = {""google_search_engine_id"":""""};    var oceanwpLocalize = {""nonce"":""fb508dccb2"",""isRTL"":"""",""menuSearchStyle"":""drop_down"",""mobileMenuSearchStyle"":""disabled"",""sidrSource"":null,""sidrDisplace"":""1"",""sidrSide"":""left"",""sidrDropdownTarget"":""link"",""verticalHeaderTarget"":""link"",""customScrollOffset"":""0"",""customSelects"":"".woocommerce-ordering .orderby, #dropdown_product_cat, .widget_categories select, .widget_archive select, .single-product .variations_form .variations select"",""ajax_url"":""https:\/\/nuforc.org\/wp-admin\/admin-ajax.php"",""oe_mc_wpnonce"":""07566153f6"",""stickyChoose"":""auto"",""stickyStyle"":""fixed"",""shrinkLogoHeight"":""30"",""stickyEffect"":""none"",""hasStickyTopBar"":"""",""hasStickyMobile"":""""};              var envira_gallery = {""debug"":"""",""ll_delay"":""500"",""ll_initial"":""false"",""ll"":""1"",""mobile"":""0""};           wp.i18n.setLocaleData( { 'text direction\u0004ltr': [ 'ltr' ] } );  var ElementorProFrontendConfig = {""ajaxurl"":""https:\/\/nuforc.org\/wp-admin\/admin-ajax.php"",""nonce"":""14712035b0"",""urls"":{""assets"":""https:\/\/nuforc.org\/wp-content\/plugins\/elementor-pro\/assets\/"",""rest"":""https:\/\/nuforc.org\/wp-json\/""},""shareButtonsNetworks"":{""facebook"":{""title"":""Facebook"",""has_counter"":true},""twitter"":{""title"":""Twitter""},""linkedin"":{""title"":""LinkedIn"",""has_counter"":true},""pinterest"":{""title"":""Pinterest"",""has_counter"":true},""reddit"":{""title"":""Reddit"",""has_counter"":true},""vk"":{""title"":""VK"",""has_counter"":true},""odnoklassniki"":{""title"":""OK"",""has_counter"":true},""tumblr"":{""title"":""Tumblr""},""digg"":{""title"":""Digg""},""skype"":{""title"":""Skype""},""stumbleupon"":{""title"":""StumbleUpon"",""has_counter"":true},""mix"":{""title"":""Mix""},""telegram"":{""title"":""Telegram""},""pocket"":{""title"":""Pocket"",""has_counter"":true},""xing"":{""title"":""XING"",""has_counter"":true},""whatsapp"":{""title"":""WhatsApp""},""email"":{""title"":""Email""},""print"":{""title"":""Print""}},""facebook_sdk"":{""lang"":""en_US"",""app_id"":""""},""lottie"":{""defaultAnimationUrl"":""https:\/\/nuforc.org\/wp-content\/plugins\/elementor-pro\/modules\/lottie\/assets\/animations\/default.json""}};     var elementorFrontendConfig = {""environmentMode"":{""edit"":false,""wpPreview"":false,""isScriptDebug"":false},""i18n"":{""shareOnFacebook"":""Share on Facebook"",""shareOnTwitter"":""Share on Twitter"",""pinIt"":""Pin it"",""download"":""Download"",""downloadImage"":""Download image"",""fullscreen"":""Fullscreen"",""zoom"":""Zoom"",""share"":""Share"",""playVideo"":""Play Video"",""previous"":""Previous"",""next"":""Next"",""close"":""Close"",""a11yCarouselWrapperAriaLabel"":""Carousel | Horizontal scrolling: Arrow Left & Right"",""a11yCarouselPrevSlideMessage"":""Previous slide"",""a11yCarouselNextSlideMessage"":""Next slide"",""a11yCarouselFirstSlideMessage"":""This is the first slide"",""a11yCarouselLastSlideMessage"":""This is the last slide"",""a11yCarouselPaginationBulletMessage"":""Go to slide""},""is_rtl"":false,""breakpoints"":{""xs"":0,""sm"":480,""md"":768,""lg"":1025,""xl"":1440,""xxl"":1600},""responsive"":{""breakpoints"":{""mobile"":{""label"":""Mobile Portrait"",""value"":767,""default_value"":767,""direction"":""max"",""is_enabled"":true},""mobile_extra"":{""label"":""Mobile Landscape"",""value"":880,""default_value"":880,""direction"":""max"",""is_enabled"":false},""tablet"":{""label"":""Tablet Portrait"",""value"":1024,""default_value"":1024,""direction"":""max"",""is_enabled"":true},""tablet_extra"":{""label"":""Tablet Landscape"",""value"":1200,""default_value"":1200,""direction"":""max"",""is_enabled"":false},""laptop"":{""label"":""Laptop"",""value"":1366,""default_value"":1366,""direction"":""max"",""is_enabled"":false},""widescreen"":{""label"":""Widescreen"",""value"":2400,""default_value"":2400,""direction"":""min"",""is_enabled"":false}}},""version"":""3.14.1"",""is_static"":false,""experimentalFeatures"":{""e_dom_optimization"":true,""e_optimized_assets_loading"":true,""e_optimized_css_loading"":true,""a11y_improvements"":true,""additional_custom_breakpoints"":true,""theme_builder_v2"":true,""landing-pages"":true,""page-transitions"":true,""notes"":true,""loop"":true,""form-submissions"":true,""e_scroll_snap"":true},""urls"":{""assets"":""https:\/\/nuforc.org\/wp-content\/plugins\/elementor\/assets\/""},""swiperClass"":""swiper-container"",""settings"":{""page"":[],""editorPreferences"":[]},""kit"":{""active_breakpoints"":[""viewport_mobile"",""viewport_tablet""],""global_image_lightbox"":""yes"",""lightbox_enable_counter"":""yes"",""lightbox_enable_fullscreen"":""yes"",""lightbox_enable_zoom"":""yes"",""lightbox_enable_share"":""yes"",""lightbox_title_src"":""title"",""lightbox_description_src"":""description""},""post"":{""id"":1440,""title"":""Gallery%20-"",""excerpt"":"""",""featuredImage"":false}};     var _wpUtilSettings = {""ajax"":{""url"":""\/wp-admin\/admin-ajax.php""}};   var wpformsElementorVars = {""captcha_provider"":""recaptcha"",""recaptcha_type"":""invisible""};",
"There were three stationary lights, they very quickly disappeared after catching a glimpse of it.  I was walking with a two friends of mine.  We were walking down a road back to one of their house's.  Something caught our attention in the corner of our eyes.  We looked up to get a glimpse of the ""ufo"", and as soon as we saw it, it just disappeared.    It was 2, or 3 orange lights.  It disappeared so quickly, it was hard to tell.  But i know it had to of been a ufo, because of the speed in which it took off after being stationary.   ((NUFORC Note:  Source of report does not indicate the time and date of the sighting.  We have attempted to contact the party, but the telephone number is blocked.  We wonder whether this is intended to be a serious report, or not.  PD))",
"these things are everywhere around here!!!  a friend and i were going to a friends house out in the gillburg community and just happened to be talking about ufo's. my friend stopped at the top of the long driveway which went in between 2 tobacco fields to relieve himself. all of a sudden he starts yelling for me to look outside the car at the sky. what we saw was what looked like a bright star to the left of the driveway. it sat there bobbing around for a few seconds, then stopped.then it shot off atan incalculable speedto thenorth towards henderson. we then proceeded down the driveway to the  house dumbfounded and amazed by what we had just seen. when we got out of the car we looked up at the opposite side of the driveway and saw 3 more objects. these objects were nowhere near where we saw the 1st one.they also stayed in one area. they were making eratic maneuvers. they would go up and down,diagonally, spiral. no human could have withstood tne g-force exerted by the craft.i went in to the house and got the girl who lived there along w/ her 7 yr old son and they witnessed the same thing. i was so amazed that i went next door to a guys house i didn't even know and showed it to him. he was just as amazed as we were.we watched them for awhile and went inside. they were still there 30 min. later when we came out. this isn't the only encounter i have had w/ these objects but it is the only time i have seen more than 1 at the time. i don't know what is going on around here. i'm not the only one seeing this. other people are seeing it too. its just that people around here don't report stuff like that. that isn't the only encounter i've had  hereeither. i've encountered other types of objects that i will write in about later.sometimes , me and a friend will go out on clear nights and look for them. we almost never come home dissapointed. if someone else in this area or anywhere has seen anything similar, e- mail me and tell me about it at ((e-address deleted)). i would love to hear your story.",
"Funny flashing lights that hovered then just dashed up into the sky, near Oscoda in the late summer of 1975.  I was 7 at the time and this is the best I can recall--sorry for the poor answers. I was camping with my indian guide group at a YMCA camp near Oscoda Michigan.  I think the camp was called camp oeasa (I am not sure how it is spelled).  There were about 15 kids and about half as many adults.  most of the adults had gone to sleep, but there were at least one or two on night watch, to keep us kids out of trouble.  We were all in sleeping bags around a camp fire, lying on our backs when I remember seeing a string for flashing lights hovering in the sky, then just shoot up into the stars after about a minute of so.  I do not remember if I saw it and started talking about it, or if someone else noticed it and I looked up.  I remember joking about it with the ohter kids.  It was very strange!  It looked just like a funny string of very funny looking Christmas tree lights flashing.  It was so long ago that I can not even guess how far away, how big, etc...  What ever it was, it did not make any sound that I can recall.  There is a near by Air base and I remember wondering if it was something from there, but I do not know of anything that could have come from Oscoda that might look and behave like that.  But then again who knows?  It is worth reporting anyhow.",
((NUFORC Note:  Witness provides no information about the alleged event.  PD)),
"Dear sir  I lived in a lucid dream state for years upon years as a child and can and do freely talk to those entities you would refer to as Nordic aliens.  I have been doing this, feeling myself one of them, and a child of them, since early childhood If you wish to know more your going to have to find me, make me feel comfortable and engage in dialogue with me If this is too much to ask then the information is too much for me to give.   ((NUFORC Note:  Witness elects to remain totally anonymous; provides no contact information.  Hence, we were unable to contact the party.  Does not indicate the location of the alleged event.  Hoax??  PD))",
"Strange sighting of huge triangular UFO spotted in Canfield, OH  A few people and I were playing basketball when my 9 year sister spotted a huge bright white object in the shaped of a triangle with some sort of bubble at the front end of it completely stunned of what was flying over us I've never seen such a thing so big and bright but it was completely silent and took of without a trace.    I stared at this object for more than a minute but some how this huge object flew away at least 2,000 mph or more startling me and the other witnesses and our beliefs have changed forever I now know that we are not the only intelligent species and there is in fact other beings beyond us humans.    Would like if Canfield, Ohio, were to be inspected by professionals because I believe this could lead to a new beginning for everyone in our world.",
"Unusual sounds and starlight distortion definitly intellegently controlled.  I was in my room, watching discovery channel when I heard what sounded like a very strong wind.  I looked out my window at the trees lining my street to see them completly calm.  So i thought it might be a jet aircraft and went outside to look.    Upon exiting my home, i realized that the sound wasnt moving.  I started scanning the sky, looking for the sound. It is a clear night out. U can see the whole of the night sky.  Stars from horizon to horizon.  There was no visible jet, or any aircraft that i could see.  I began searching for FAA running light, hoping to use them to locate the source of the sound.  There where no lights anywhere.   I then began trying to use the complete star banket as a means of location.  When an aircraft moves through the night sky, it has to pass under the stars, thereby blocking some out as it moves.  There where no disturbances in the area that the sound was coming from.  As i was about to just go back inside, thinking it was just a high wind off up in the area above the tree line, the sound began to move at a slow but accelerating rate due north.   I again began to use the star light to try and locate the source as it moved.   It was then i saw a weird distortion.  Not a true blocking of starlight.  But more of a moving of the starlight, like it was being forced around something.  As i tried to follow the distortion visually, it accelerated at a phenomenal rate north and both the sound, and distortion disappeared.    I would like to apologize about the condition of this report.  My only access to the internet is a oldish cell phone.    I hope you read this and believe that this is not a hoax, or my imagination as my family seems to think.   I know what i heard, and i know what i saw.    Thank you for your time.",
"they were close to my home, hope they come soon ....im waiting.....  It was dark, clear night with the moon very bright, and I saw an black shaped almost like a boomerang with no lights coming over my house, about 1000 feet up,   Then 2 jets behind it, chasing it, but then just before my eyes it vanished, poof.  Then, the 2 jets turned around and headed west.    Then a day later I filmed a video of a circle shaped orb over my home...loved it .hope to see them soon ....thnks",
